en,te
He will be back soon.,అతను త్వరలో తిరిగి వస్తాడు.
I'd never seen you so afraid before.,నేను ఇంతకు ముందు మిమ్మల్ని ఇంత భయంతో చూడలేదు.
I have an excuse.,నాకు ఒక అవసరం లేదు.
girl,అమ్మాయి
forgot,మర్చిపోయాను
Strange things happened that night.,ఆ రాత్రి వింతైన విషయాలు జరిగాయి.
Tom swore he wouldn't do that.,టామ్ తాను అలా చేయనని ప్రమాణం చేశాడు.
We're firing you.,మేము మిమ్మల్ని తొలగిస్తున్నాము.
Please write to me when you get there.,మీరు అక్కడికి చేరుకున్నప్పుడు నాకు వ్రాయండి.
Tom is going to miss you.,టామ్ మిమ్మల్ని కోల్పోతాడు.
Avinash is a good player.,అవినాష్ మంచి ఆటగాడు.
A temple is a building reserved for spiritual rituals and activities such as prayer and sacrifice.,దేవాలయం అనేది ఆధ్యాత్మిక ఆచారాలు మరియు ప్రార్థన మరియు త్యాగం వంటి కార్యకలాపాల కోసం ప్రత్యేకించబడిన భవనం.
Hot climate,వేడి వాతావరణం
It's happening too fast.,ఇది చాలా వేగంగా జరుగుతోంది.
Tom stomped his foot angrily.,టామ్ కోపంగా తన పాదాన్ని కొట్టాడు.
I had to drop out of college and get a job.,నేను కాలేజీ నుండి తప్పుకొని ఉద్యోగం పొందవలసి వచ్చింది.
Our son was killed in the war.,మా కొడుకు యుద్ధంలో చంపబడ్డాడు.
I'm really sorry about what happened.,ఏమి జరిగిందో నేను నిజంగా క్షమించండి.
please excuse me,దయచేసి నన్ను క్షేమించండి
where is your sister studying,మీ చెల్లి ఎక్కడ చదువుతోంది
Native place,స్వస్థలము
Native house,స్థానిక ఇల్లు
King loves forestation.,రాజుకు అడవులు అంటే చాలా ఇష్టం
How can I learn Telugu?,నేను తెలుగు ఎలా నేర్చుకోవాలి?
Mother,అమ్మా
Father,తండ్రి
Sister,సోదరి
Brother,సోదరుడు
Suneetha is trying to learn Tamil.,సునీత తమిళం నేర్చుకోవడానికి ప్రయత్నిస్తోంది.
Tom swam with the dolphins.,టామ్ డాల్ఫిన్లతో ఈదుకున్నాడు.
Tom has written a book about birds.,టామ్ పక్షుల గురించి ఒక పుస్తకం రాశాడు.
"I am planning to visit Kyoto, and Nara as well.","నేను క్యోటో, మరియు నారాలను కూడా సందర్శించాలని ఆలోచిస్తున్నాను."
"You live here alone, don't you?","మీరు ఇక్కడ ఒంటరిగా నివసిస్తున్నారు, లేదా?"
Didn't you know that Tom was planning to go to Australia?,టామ్ ఆస్ట్రేలియా వెళ్ళాలని యోచిస్తున్నాడని మీకు తెలియదా?
I forgot to lock the front door.,నేను ముందు తలుపు లాక్ చేయడం మర్చిపోయాను.
You're an excellent writer.,మీరు అద్భుతమైన రచయిత.
I woke up three times during the night.,నేను రాత్రి సమయంలో మూడుసార్లు మేల్కొన్నాను.
Tom was defeated.,టామ్ ఓడిపోయాడు.
"Tom isn't a bus driver, is he?","టామ్ బస్సు డ్రైవర్ కాదు, అవునా?"
I want to apologize for everything I said.,నేను చెప్పిన ప్రతిదానికీ క్షమాపణ చెప్పాలనుకుంటున్నాను.
I do not have to study Japanese.,నేను జపనీస్ అధ్యయనం చేయవలసిన అవసరం లేదు.
I've read every book on this shelf.,నేను ఈ షెల్ఫ్‌లోని ప్రతి పుస్తకాన్ని చదివాను.
I was in Boston last winter.,నేను గత శీతాకాలంలో బోస్టన్‌లో ఉన్నాను.
Tom was one of my better students.,టామ్ నా మంచి విద్యార్థులలో ఒకడు.
The police went over every inch of this place.,పోలీసులు ఈ స్థలం యొక్క ప్రతి అంగుళం మీదుగా వెళ్లారు.
Tom told me I was mistaken.,టామ్ నాకు పొరపాటు అని చెప్పాడు.
This box is empty. It has nothing in it.,ఈ పెట్టె ఖాళీగా ఉంది.
Thank you for the wonderful gift.,అద్భుతమైన బహుమతికి ధన్యవాదాలు.
Tom died in his seventies.,టామ్ తన డెబ్బైలలో మరణించాడు.
What do you think this is?,ఇది ఏమిటి?
Tom visited Mary.,టామ్ మేరీని సందర్శించాడు.
I knew this would be hard for you.,ఇది మీకు కష్టమని నాకు తెలుసు.
Both boys and girls should take cooking class in school.,బాలురు మరియు బాలికలు ఇద్దరూ పాఠశాలలో వంట తరగతి తీసుకోవాలి.
What's your son's name?,మీ కొడుకు పేరు ఏమిటి?
He got up at eight in the morning.,అతను ఉదయం ఎనిమిది గంటలకు లేచాడు.
Tom didn't need to wait.,టామ్ వేచి ఉండాల్సిన అవసరం లేదు.
Questions and answers,ప్రశ్నలు మరియు సమాధానాలు
Sold,విక్రయించబడింది
Krishna tells the Pandavas about the cruelty of Duryodhana.,కృష్ణుడు దుర్యోధనుడి క్రూరత్వం గురించి పాండవులకు చెప్పాడు.
Sanskrit is an ancient language that originated in the Indian subcontinent.,సంస్కృతం భారతీయ ఉపఖండంలో ఉద్భవించిన ప్రాచీన భాష.
Proud to be an Indian.,భారతీయుడిగా గర్విస్తున్నాను.
Indian,భారతీయుడు
God,దేవుడు
The temple is one of the oldest and most prominent temples in Nellore.,ఈ ఆలయం నెల్లూరులోని పురాతన మరియు ప్రముఖ దేవాలయాలలో ఒకటి.
It is one of the most visited pilgrimage sites in the world.,ప్రపంచంలో అత్యధికంగా సందర్శించే తీర్థయాత్రలలో ఇది ఒకటి.
rich,ధనవంతుడు
RRR is an epic action drama movie.,RRR ఒక ఎపిక్ యాక్షన్ డ్రామా మూవీ.
Chatrapati shivaji one of the most powerful empires in India during the 17th and 18th centuries.,చత్రపతి శివాజీ 17వ మరియు 18వ శతాబ్దాలలో భారతదేశంలోని అత్యంత శక్తివంతమైన సామ్రాజ్యాలలో ఒకటి.
Swami Vivekananda was a disciple of the great Indian saint.,స్వామి వివేకానంద గొప్ప భారతీయ సాధువు శిష్యుడు.
a famous speech,ఒక ప్రసిద్ధ ప్రసంగం
plants,మొక్కలు
hungry,ఆకలి
ourself,మనమే
quickly,త్వరగా
slowly,నెమ్మదిగా
Why are running very slowly?,ఎందుకు చాలా నెమ్మదిగా నడుస్తున్నాయి?
Directions,దిశలు
Where are you located?,మీరు ఎక్కడ ఉన్నారు?
Very very good,చాలా చాలా మంచిది
Why,ఎందుకు
I am very happy to meet you,మిమ్మల్ని కలవడం నాకు చాలా సంతోషంగా ఉంది
Happy Birthday to you.,నీకు పుట్టిన రోజు శుభాకాంక్షలు.
school,పాఠశాల
i am going to sleep,నేను నిద్రించటానికి వెళుతున్నాను
actor,నటుడు
Sunil is an ultimate comedian.,సునీల్ అంతిమ హాస్యనటుడు.
sports,క్రీడలు
i am very tired,నేను బాగా అలసిపోయాను
don't manipulate me,నన్ను తారుమారు చేయవద్దు
His legs are long.,అతని కాళ్ళు పొడవుగా ఉంటాయి.
Sai is feeling good,ఆమె మెరుగైన అనుభూతి ఉంది
Where are you going,మీరు ఎక్కడికి వెళ్తున్నారు?
"Telugu, english, tamil, french","తెలుగు, ఇంగ్లీష్, తమిళ, ఫ్రెంచ్"
How many times a year do you go skiing?,మీరు సంవత్సరానికి ఎన్నిసార్లు స్కీయింగ్ వెళ్తారు?
I just don't think I'm successful enough.,నేను తగినంత విజయవంతం కాలేదు అనుకుంటున్నాను.
"Whether you believe it or not, I want to get this thing over with as much as you do.","మీరు నమ్మండి లేదా కాదు, నేను మీరు చేసిన వంటి ఈ చాలా పొందాలనుకుంటున్నాను."
Students should develop their reading skills.,విద్యార్థులు తమ పఠన నైపుణ్యాలను అభివృద్ధి చేసుకోవాలి.
Clean the barrel of this rifle.,ఈ తుపాకీ యొక్క బారెల్ శుభ్రం.
He is the oldest of them all.,ఆయన వారిలో గొప్పవాడు.
That I can't tell you.,నేను మీరు చెప్పలేను.
Things changed after that.,కానీ అప్పుడు విషయాలు మార్చబడ్డాయి.
The dining room has two doors.,భోజన గదిలో రెండు తలుపులు ఉన్నాయి.
They'll do what I tell them to do.,నేను చెప్పినట్లు వారు చేస్తారు.
Tom had a narrow escape from death.,టామ్ మరణం నుండి సన్నగా తప్పించుకున్నాడు.
My father died before I got my diploma.,నా డిప్లొమా రాకముందే నా తండ్రి మరణించాడు.
Tom and Mary believed John.,టోమ్ మరియు మేరీ జాన్ నమ్మేవారు.
I think I can come over this afternoon.,నేను ఈ మధ్యాహ్నం రావచ్చు అనుకుంటున్నాను.
I believe you all know Tom.,మీరు అందరూ టామ్ను తెలుసు.
I wonder who'll come.,ఎవరు వస్తారు అని నేను ఆశ్చర్యపోతున్నాను.
Tom thinks I need to help Mary.,నేను మేరీకి సహాయం చేయాల్సి ఉందని టామ్ భావిస్తాడు.
They were all actors.,వారు అన్ని నటులు.
Tom said he couldn't walk.,టోమ్ అతను నడవలేనని చెప్పాడు.
Where exactly does Tom live?,టామ్ ఎక్కడ నివసిస్తున్నాడు?
Tom lived in Boston when he was a child.,టామ్ చిన్నతనంలో బోస్టన్లో నివసించాడు.
How many people know about this?,ఎంత మంది ఈ గురించి తెలుసు?
I thought it was a mistake.,నేను అది ఒక ఫకింగ్ తప్పు అని భావించారు.
I did everything the way Tom told me to do it.,నేను టోమ్ చెప్పిన ప్రతిదీ చేశాను.
Tom has written down a list of things we need to do.,మనం చేయవలసిన విషయాల జాబితాను టామ్ రాశాడు.
I can help you now.,నేను ఇప్పుడు మీకు సహాయం చేయవచ్చు.
Tom is the youngest of my three children.,టోమ్ నా ముగ్గురు పిల్లలలో చిన్నవాడు.
"Tom is thirteen, but he still believes in Santa.","టామ్ పదమూడు సంవత్సరాలు, కానీ అతను ఇప్పటికీ శాంటా నమ్మకం."
"Tom, do you have a moment?","టామ్, మీరు ఒక క్షణం ఉందా?"
Tom told me you were afraid.,నేను భయపడుతున్నానని టామ్ చెప్పాడు.
I don't think that Tom was busy yesterday.,నేను టామ్ నిన్న బిజీగా ఉన్నట్లు అనుకోను.
Should I help Tom with his homework?,నేను టామ్కు తన ఇంటి పనులతో సహాయం చేయాలా?
I do think people will use it.,ప్రజలు దానిని ఉపయోగించుకుంటారు అనుకుంటున్నాను.
I must've left my wallet at home.,నేను ఇంట్లో నా జేబును వదిలి ఉండాలి.
Where did you get all this stuff?,మీరు ఈ అన్ని నుండి వచ్చింది?
That's his weak spot.,ఇది అతని బలహీనమైన స్థానం.
I think Tom is gone.,నేను టామ్ పోయాడని అనుకుంటున్నాను.
Come here.,"ఇక్కడ వస్తాయి, దయచేసి."
Tom is always crying.,టామ్ ఎప్పుడూ ఏడుస్తాడు.
We took him to the hospital.,మేము ఆసుపత్రికి అతనిని తీసుకువెళ్ళారు.
We traveled to Mexico by plane.,మేము మెక్సికోకు వెళ్లింది.
Don't dress like a tourist.,ఒక పర్యాటక వంటి దుస్తులు లేదు.
I don't support his ideas.,నేను అతని ఆలోచనలను మద్దతు లేదు.
Remember what we spoke about yesterday.,మేము నిన్న గురించి మాట్లాడిన గుర్తుంచుకో.
Give a thief enough rope and he'll hang himself.,ఒక దొంగ తగినంత తాడు ఇవ్వండి మరియు అతను వేలాడదీయబడుతుంది.
Am I making myself clear?,నేను ఏమీ చెప్పను.
Tom sometimes agrees with me.,కొన్నిసార్లు టామ్ నాతో అంగీకరిస్తాడు.
Tom's daughter is now thirteen.,టామ్ కుమార్తె ఇప్పుడు పదమూడు సంవత్సరాలు.
My doctor told me that I needed to lose some weight.,నా డాక్టర్ నాకు కొంత బరువు తగ్గాలని చెప్పాడు.
Tom was stupid enough to challenge Mary to a game of chess.,"టోమ్ ఒక మూర్ఖుడు, మేరీని ఒక చెక్ గేమ్కు సవాలు చేశాడు."
Where do you plan to spend the summer?,మీరు వేసవి ఎక్కడ గడపాలని ప్లాన్ చేస్తారు?
She drives an imported car.,ఆమె ఒక దిగుమతి కారు డ్రైవ్.
They keep calling.,వారు కాల్స్ కొనసాగించడానికి.
You can't take it with you.,మీరు మీతో తీసుకెళ్లలేరు.
"You've never had a boyfriend, have you?","మీరు ఒక ప్రియుడు ఎప్పుడూ, మీరు?"
Japan is subject to earthquakes.,జపాన్ భూకంపాలకు గురవుతోంది.
Tom doesn't want to go there alone.,టోమ్ ఒంటరిగా వెళ్ళడానికి ఇష్టపడడు.
Let's sit down on the bench.,బెంజ్ మీద కూర్చుని లెట్.
Tom should've stayed at home.,టామ్ ఇంట్లోనే ఉండి ఉండాలి.
Tom and Mary are planning to get a divorce.,టామ్ మరియు మేరీ విడాకులు తీసుకోవాలని ప్లాన్ చేస్తున్నారు.
Tom's sister paved the way for him to become a lawyer.,టోమ్ యొక్క సోదరి ఒక న్యాయవాది కావడానికి అతనికి మార్గం సుగమం చేసింది.
I want you to give a message to Tom.,మీరు టోమ్కు ఒక సందేశాన్ని ఇవ్వాలని నేను కోరుకుంటున్నాను.
I love comedies.,నేను కామెడీ ఇష్టం.
The couple broke off their engagement.,ఈ జంట వారి నిశ్చితార్థం ముగిసింది.
How much money do we need?,ఎంత డబ్బు మాకు అవసరం?
Tom is probably still hiding.,టామ్ ఇప్పటికీ దాగి ఉండవచ్చు.
He predicted she would win.,ఆమె గెలుస్తానని అతను అంచనా వేసాడు.
He often gets sick.,అతను తరచుగా అనారోగ్యంతో.
Tom said you were busy.,మీరు బిజీగా ఉన్నారని టామ్ చెప్పాడు.
The party finished at nine.,పార్టీ తొమ్మిది గంటలకు ముగిసింది.
Tom and I are going to the mall.,టామ్ మరియు నేను మాల్కు వెళ్తున్నాము.
Let's not fool ourselves.,మనల్ని మోసం చేద్దాం.
Tom noticed Mary was there.,మేరీ అక్కడ ఉన్నాడని టామ్ గమనించాడు.
I'm feeding my baby.,నేను నా బిడ్డను తిండికి ఇస్తున్నాను.
Tom wants to play tennis with Mary.,టోమ్ మేరీతో టెన్నిస్ ఆడాలనుకుంటాడు.
Ain't that cute?,ఇది cute కాదు?
Both of us should lose some weight.,మేము రెండు కొన్ని బరువు కోల్పోతారు అవసరం.
Tom is a hot-blooded individual.,టామ్ ఒక వేడి రక్తం మనిషి.
Tom thinks that he's always right.,టామ్ ఎప్పుడూ అతను సరైనవాడు అని అనుకుంటున్నాడు.
President Monroe was a slave-owner.,అధ్యక్షుడు మోన్రో ఒక బానిస యజమాని.
The sky was gray all morning.,ఆకాశం ఉదయం అంతా బూడిద రంగులో ఉంది.
They are going to send up a rocket.,వారు ఒక రాకెట్ పంపడానికి వెళ్తున్నారు.
Tom works at a nearby restaurant.,టామ్ సమీపంలోని రెస్టారెంట్లో పనిచేస్తాడు.
Stop hiding your head in the sand.,మీ తల ఇసుక లో దాచడానికి ఆపడానికి.
I helped.,నేను సహాయం.
I think that it's time for us to tell Tom the truth.,నేను టామ్కు నిజం చెప్పాల్సిన సమయం ఆసన్నమైందని అనుకుంటున్నాను.
He has a Toyota.,అతను ఒక టయోటా ఉంది.
The house requires repairs.,ఇల్లు మరమ్మతు అవసరం.
"My mother is a teacher, too.",నా తల్లి కూడా ఉపాధ్యాయురాలు.
Nobody said a thing.,ఎవరూ ఏమీ చెప్పారు.
I use Google almost every day.,నేను దాదాపు ప్రతిరోజూ గూగుల్ ఉపయోగిస్తాను.
Whales feed on small fish.,తిమింగలాలు చిన్న చేపలు తింటాయి.
Both Tom and I'll be busy this afternoon.,టోమ్ మరియు నేను ఈ మధ్యాహ్నం ఇద్దరూ బిజీగా ఉంటాము.
Don't you watch movies?,మీరు సినిమాలు చూడలేరు?
Didn't you know Tom and Mary often travel together?,టామ్ మరియు మేరీ తరచుగా కలిసి ప్రయాణిస్తున్నారని మీకు తెలుసా?
"Unfortunately, that's true.","దురదృష్టవశాత్తు, ఇది నిజం."
I don't find that very funny.,నేను చాలా హాస్యాస్పదంగా కనిపించడం లేదు.
Tom refused to help Mary.,టోమ్ మేరీకి సహాయం చేయడానికి నిరాకరించాడు.
I see life differently now.,ఇప్పుడు నేను జీవితాన్ని భిన్నంగా చూస్తున్నాను.
Who is your favorite pianist?,మీ ఇష్టమైన పియానోయిస్ట్ ఎవరు?
I saw Tom in church today.,నేను టోమ్ను చర్చిలో ఈ రోజు చూశాను.
That's what we're waiting for.,మేము ఆ వేడుక కోసం ఎదురుచూస్తున్నాము.
"Mary is a pretty girl, isn't she?","మేరీ ఒక అందమైన అమ్మాయి, ఆమె కాదు?"
I strongly suspected that he had been lying.,అతను అబద్ధం చెబుతున్నాడని నేను గట్టిగా అనుమానించాను.
Tom looked both ways before crossing the road.,రోడ్డు దాటడానికి ముందు టోమ్ రెండు మార్గాలను చూశాడు.
Shadow him.,అతనిని నీడ.
I let him get the credit.,నేను అతనికి క్రెడిట్ పొందటానికి అనుమతించారు.
Did you forget to feed the dog?,మీరు కుక్క తిండికి మర్చిపోతే?
Tom wanted to quit smoking.,టామ్ ధూమపానం విడిచిపెట్టాలని కోరుకున్నాడు.
I expect a detailed report.,నేను వివరణాత్మక నివేదిక కోసం ఆశిస్తున్నాను.
We have nothing in common.,మాకు ఏదీ లేదు.
Carry on with your work.,మీ పని కొనసాగించండి.
Tom continued laughing.,టోమ్ నవ్వుతూనే ఉన్నాడు.
How do you like that?,మీరు ఎలా అది ఇష్టం?
Tom is old enough to drive.,టామ్ డ్రైవింగ్ చేయడానికి తగినంత వయస్సులో ఉన్నాడు.
Tom and I walk to school together every morning.,నేను మరియు టామ్ ప్రతి ఉదయం కలిసి పాఠశాలకు నడుస్తాము.
Will anybody be at the station to meet me?,ఎవరైనా స్టేషన్ వద్ద నన్ను కలవడానికి ఉంటుంది?
I don't think that everyone is here yet.,నేను ప్రతి ఒక్కరూ ఇప్పటికీ ఇక్కడ ఉన్నట్లు అనుకోను.
This is the hottest summer that we have had in thirty years.,ఇది 30 సంవత్సరాలలో మేము కలిగి ఉన్న అత్యంత వేడి వేసవి.
We had a chance.,మాకు అవకాశం ఉంది.
The rice crop is poor this year.,ఈ సంవత్సరం బియ్యం పంట పేదది.
I want to write this down.,నేను ఈ వ్రాయడానికి కావలసిన.
Please forgive me. I didn't mean to be rude.,దయచేసి నన్ను క్షమించండి.
Asia is roughly four times the size of Europe.,ఆసియా ఐరోపా కంటే నాలుగు రెట్లు పెద్దది.
