en,te
Let's leave as soon as he gets back.,అతను తిరిగి వచ్చినప్పుడు మేము వెళ్ళి.
Where's it used?,అది ఎక్కడ ఉపయోగించబడింది?
You've probably forgotten about it already.,మీరు ఇప్పటికే దాని గురించి మర్చిపోయారు.
You shouldn't let him get away with cheating.,మీరు మోసగించడం ద్వారా ఆయన నుండి పారిపోకూడదు.
We have to get out of here fast.,మేము త్వరగా ఇక్కడ నుండి వెళ్ళి అవసరం.
Tom can't answer.,టామ్ సమాధానం చెప్పలేడు.
The cat is in the box.,పిల్లి బాక్స్ లో ఉంది.
You were treated unfairly.,మీరు అన్యాయంగా చికిత్స చేశారు.
It's obsolete.,ఇది ఉపయోగించబడలేదు.
What's the fastest way to get to the airport?,విమానాశ్రయానికి చేరుకోవడానికి వేగవంతమైన మార్గం ఏమిటి?
Tom didn't know Mary wanted him to help her.,మేరీ అతనికి సహాయం చేయాలన్న విషయం టామ్కు తెలియదు.
I don't have a lot of patients.,నాకు చాలా మంది రోగులు లేరు.
Tom will need your help.,టోమ్ మీ సహాయం కావాలి.
I think I speak French about as well as Tom does.,నేను టోమ్ గురించి ఫ్రెంచ్ మాట్లాడతాను.
"In New York, the dollar was worth eight shillings.",న్యూయార్క్ లో ఒక డాలర్ విలువ ఎనిమిది షీలింగ్లు.
Look what I found on my way home.,ఇంటికి మార్గంలో నేను కనుగొన్న చూడండి.
We will now report on this year's business results.,ఈ సంవత్సరం వ్యాపార ఫలితాల గురించి ఇప్పుడు నివేదిస్తాం.
This will take some time.,ఇది కొంత సమయం పడుతుంది.
It took me several hours to paint that room.,ఆ గదిని చిత్రించడానికి నాకు చాలా గంటలు పట్టింది.
We know what to expect.,మేము ఏమి ఆశించే తెలుసు.
Did you really dream about me?,మీరు నిజంగా నా గురించి కలలు కంటున్నారా?
You probably just have a cold.,మీరు ఒక చల్లని కలిగి ఉండవచ్చు.
Tom says he was fired.,టోమ్ అతను తొలగించారు చెప్పారు.
Please stay inside.,దయచేసి లోపల ఉండండి.
Can you please tell me where the restaurant is?,మీరు రెస్టారెంట్ ఎక్కడ ఉంది దయచేసి నాకు చెప్పగలరా?
Don't you feel cold?,మీరు చల్లని అనుభూతి?
Can she come in time?,ఆమె సమయానికి చేరుకుంటుంది?
You can't know that.,మీరు ఆ తెలియదు.
I'll dream about you.,నేను మీరు గురించి కలలుకంటున్న.
The customer is not always right.,కస్టమర్ ఎల్లప్పుడూ సరైనది కాదు.
I have things on my mind.,నా మనస్సులో విషయాలు ఉన్నాయి.
All of the men were dressed similarly to Tom.,అన్ని పురుషులు టామ్ లాగా దుస్తులు ధరించారు.
I've burnt the toast.,నేను ఒక పానీయం కోసం బర్న్ చేశారు.
That was an experience.,ఇది ఒక అనుభవం.
I hate myself.,నేను నా సొంత ద్వేషం.
I told Tom you'd wait.,నేను టోమ్ను వేచి ఉండమని చెప్పాను.
Tom started packing his suitcase.,టామ్ తన సంచిని ప్యాక్ చేయడం ప్రారంభించాడు.
I've been expecting your call.,నేను మీ కాల్ కోసం వేచి ఉన్నాను.
I wish she had come last night.,ఆమె గత రాత్రి వచ్చిన ఉంటే నేను అనుకుంటున్నారా.
I had a good time.,నేను ఒక మంచి సమయం కలిగి.
It soon began to rain very hard.,త్వరలోనే భారీ వర్షం కురిపించింది.
I don't care what will become of me.,నాకు ఏమి జరుగుతుంది నేను పట్టించుకోను.
Please lock the door.,దయచేసి తలుపు లాక్.
I know that Tom was first.,టామ్ మొదటివాడు అని నాకు తెలుసు.
I think I need braces.,నేను గడ్డి అవసరం అనుకుంటున్నాను.
Have you ever climbed Mt. Fuji?,మీరు ఎప్పుడైనా మౌంట్ ఎక్కింది?
I'll call back soon.,నేను వెంటనే మీరు తిరిగి కాల్ చేస్తుంది.
What makes you think that I'm against that?,నేను వ్యతిరేకంగా ఏమి అనుకుంటున్నారు?
We have a complete set of the recordings of Beethoven's symphonies.,మేము బెథోవెన్ యొక్క సింఫోని రికార్డింగ్స్ పూర్తి సెట్ కలిగి.
She's thirty-three.,ఆమె ముప్పై మూడు సంవత్సరాల.
Tom said he'll wait.,టోమ్ అతను వేచి ఉంటానని చెప్పాడు.
He lost his temper and shouted at me.,అతను తన కోపం కోల్పోయింది మరియు నాకు కేకలు.
Does Tom really have a girlfriend?,టామ్కు నిజంగా స్నేహితురాలు ఉందా?
There are some differences.,కొన్ని తేడాలు ఉన్నాయి.
It's pretty amazing.,ఇది అద్భుతమైన ఉంది.
To lose face means to be humiliated.,ముఖం కోల్పోవడం అవమానంగా ఉంటుంది.
Everybody knows that he is honest.,అతను నిజాయితీగా ఉన్నట్లు అందరికీ తెలుసు.
I want to make some changes.,నేను కొన్ని మార్పులు చేయాలనుకుంటున్నాను.
It's going to be a long trip.,ఇది సుదీర్ఘ ప్రయాణం అవుతుంది.
It just won't work.,ఇది పని లేదు.
Enjoy yourself.,సంతోషంగా ఉండండి.
I'm not going to sing.,నేను పాడటం లేదు.
I didn't know Tom was at home.,టోమ్ ఇంట్లో ఉన్నాడని నాకు తెలియదు.
Tom and Mary said they'd be a bit late.,టామ్ మరియు మేరీ వారు కొంచెం ఆలస్యం అవుతారని చెప్పారు.
Is that enough?,అది తగినంత?
Choose one.,ఒకదాన్ని ఎంచుకోండి.
Tom doesn't know how sick Mary is.,మేరీ ఎంత అనారోగ్యంతో ఉన్నారో టామ్కు తెలియదు.
Their house is near here.,వారి ఇల్లు ఇక్కడ ఉంది.
Tom didn't want to admit he was scared.,టోమ్ తనకు భయం ఉందని ఒప్పుకోవాలనుకోలేదు.
The door must not be left open.,తలుపు తెరిచి ఉంచవద్దు.
The Normans conquered England in 1066.,1066లో నార్మన్లు ఇంగ్లాండ్ను జయించారు.
He dug a hole in the garden.,అతను తోట లో ఒక రంధ్రం త్రవ్విన.
Tom is going to be jealous.,టామ్ అసూయపడతాడు.
She left the room without saying a word.,ఆమె ఒక పదం చెప్పకుండా గదిని విడిచిపెట్టింది.
Tom is our foster son.,టామ్ మన దత్తపుత్రుడు.
Let us tell you why we came.,మేము ఇక్కడ ఎందుకు ఉన్నాము మీరు చెప్పండి.
Mary doesn't want to end up being an old maid.,మేరీ ఒక వృద్ధ మహిళగా ఉండటానికి ఇష్టపడదు.
"You can hear English on Channel 1, and Japanese on Channel 7.",మీరు ఛానల్ 1 లో ఇంగ్లీష్ మరియు ఛానల్ 7 లో జపనీస్ వినవచ్చు.
Owls hunt at night.,రాత్రి సమయంలో ఈ పావురాలు వేటాడతాయి.
They arrived at the hotel.,వారు హోటల్ వద్ద వచ్చారు.
I had lunch with Tom today.,నేను ఈ రోజు టోమ్తో భోజనం చేశాను.
I was really depressed.,నేను నిజంగా నిరాశపడ్డాను.
I slept only two hours.,నేను కేవలం రెండు గంటల నిద్ర.
Everybody jumped into the pool.,అందరూ పూల్ లోకి దూకింది.
I told Tom to go to the police.,నేను పోలీసులకు వెళ్లమని టామ్కు చెప్పాను.
I can't stand raw fish.,నేను ముడి చేపలు తట్టుకోలేము.
Tom had absolutely no idea what to do.,టోమ్ ఏమి చేయాలో ఖచ్చితంగా తెలియదు.
The waiter came over to take away Tom's empty plate.,టోమ్ యొక్క ఖాళీ ప్లేట్ను తొలగించడానికి వంటగదివాడు వచ్చాడు.
I don't think that we'll ever know what happened to Tom.,టామ్కు ఏమి జరిగిందో మనం ఎప్పటికీ తెలుసుకుంటామని నేను అనుకోను.
I cannot possibly help you.,నేను మీకు సహాయం చేయలేను.
I didn't swim because it was too cold.,నేను ఈత కొట్టలేదు ఎందుకంటే చల్లగా ఉంది.
My father says he's planning to buy me a horse.,నా తండ్రి అతను నాకు ఒక గుర్రం కొనుగోలు ప్లాన్ చెప్పారు.
Tom is seldom home.,టామ్ అరుదుగా ఇంట్లో ఉంటాడు.
I respect you for what you have done.,మీరు చేసినందుకు నేను మీకు గౌరవం ఇస్తాను.
Tom loved the song even though the lyrics were in a language he didn't understand.,పాటకు టోమ్కు ఇష్టం. పాటలోని పాటలు తనకు అర్థం కాని భాషతో ఉన్నా.
The teacher wrote French words on the blackboard.,ఉపాధ్యాయుడు బ్లాక్బోర్డుపై ఫ్రెంచ్ పదాలను రాశాడు.
Here's where they usually have dinner.,ఇక్కడ వారు సాధారణంగా ఒక విందు కలిగి.
Tom told us he loved skiing.,మేము స్కీయింగ్ను ప్రేమిస్తున్నామని టామ్ చెప్పాడు.
I've learned so much from you.,నేను మీ నుండి చాలా నేర్చుకున్నాను.
The time will come when she'll regret it.,ఆమె దానిని చింతిస్తుంది.
Tom's unstoppable.,టోమ్ నిరోధించలేనివాడు.
Tom has been managing just fine.,టోమ్ బాగానే ఉన్నాడు.
I have cut my finger.,నేను నా వేలు కట్.
I'll tell you everything that you want to know.,మీరు తెలుసుకోవాలనుకునే ప్రతిదీ నేను మీకు చెప్తాను.
Are you sleepy?,మీరు నిద్రపోతున్నారా?
I sat down next to him.,నేను అతని పక్కన కూర్చున్నాను.
You did your job well.,మీరు మీ ఉద్యోగం బాగా చేసారు.
"If you want quality, pay for it.","మీరు నాణ్యత కోరుకుంటే, దాని కోసం చెల్లించండి."
Tom was the only one not sitting.,టామ్ మాత్రమే కూర్చుని లేదు.
Tom refused to answer our questions.,మా ప్రశ్నలకు సమాధానం ఇవ్వడానికి టామ్ నిరాకరించాడు.
I have nothing to do this afternoon.,నేను ఈ మధ్యాహ్నం ఏమీ లేదు.
We think you're right.,మేము మీరు కుడి ఉన్నాయి అనుకుంటున్నాను.
You shouldn't trust anything Tom says.,మీరు టోమ్ చెప్పిన ప్రతిదాన్ని నమ్మకూడదు.
There are three printing presses in the workshop.,వర్క్షాప్ లో మూడు ప్రింటింగ్ ప్రెస్ లు ఉన్నాయి.
Is it true that Tom can't see very well out of his left eye?,టామ్ తన ఎడమ కన్నుతో బాగా చూడలేడు అనేది నిజం?
I don't think that Tom knows the rules yet.,టామ్ ఇంకా నియమాలను తెలుసునని నేను అనుకోను.
I like your apartment.,నేను మీ అపార్ట్మెంట్ ఇష్టం.
Would you like a glass of water?,మీరు ఒక గాజు నీరు కావాలా?
The computer is broken.,కంప్యూటర్ విచ్ఛిన్నమైంది.
Tom doesn't like competition.,టోమ్ పోటీని ఇష్టపడలేదు.
Why pay when you can get it for free?,మీరు ఉచితంగా పొందవచ్చు ఉన్నప్పుడు ఎందుకు చెల్లించాలి?
Tom asked Mary to wait for him here.,టోమ్ మేరీని ఇక్కడే వేచి ఉండమని కోరాడు.
What does this machine do exactly?,ఈ యంత్రం సరిగ్గా ఏమి చేస్తుంది?
"I admit, I'm not the tidiest person in the world.","నేను ఒప్పుకుంటాను, నేను ప్రపంచంలో ఉత్తమ వ్యక్తి కాదు."
Where do I sign up?,నేను ఎక్కడ నమోదు చేయాలి?
I really liked the movie.,నేను నిజంగా సినిమా ఇష్టపడ్డారు.
Tom is the only person Mary says she can trust.,మేరీ ఆమెను విశ్వసించగలనని చెప్పిన ఏకైక వ్యక్తి టోమ్.
Tell Tom that I'll prune his trees for him.,నేను అతని చెట్లను కత్తిరించేవాడిని అని టామ్కు చెప్పండి.
I'd like to ask you for some advice.,నేను మీరు కొన్ని సలహా అడగండి అనుకుంటున్నారా.
Can you imagine what life would be like without television?,టెలివిజన్ లేకుండా జీవితం ఎలా ఉంటుందో ఊహించగలరా?
There was a tall tree in front of my house.,నా ఇంటి ముందు ఒక పొడవైన చెట్టు ఉంది.
Should I quit my job?,నేను నా ఉద్యోగం వదిలి ఉండాలి?
I wish I had Tom's brains.,నేను టామ్ యొక్క మెదడు కలిగి ఉంటే అనుకుంటున్నారా.
Didn't you know that Tom and I needed to do that?,టామ్ మరియు నేను అలా చేయాల్సిన అవసరం ఉందని మీకు తెలుసా?
We've been looking for you everywhere.,మేము మీరు ప్రతిచోటా వెతుకుతున్న చేశారు.
I want you to put out that cigarette.,నేను మీరు ఆ సిగరెట్ ఆఫ్ చెయ్యాలని అనుకుంటున్నాను.
Tom asked Mary what was wrong.,ఏం తప్పు అని టోమ్ మేరీని అడిగాడు.
I used to cry a lot.,నేను చాలా ఏడుస్తాను.
There isn't anywhere else to park.,పార్కింగ్ కోసం వేరే చోటు లేదు.
He is no ordinary man.,అతను ఒక సాధారణ వ్యక్తి కాదు.
He can touch his nose with his tongue.,అతను తన నాలుకతో తన ముక్కు తాకే చేయవచ్చు.
"If he's still alive, he'd be very old by now.","అతను ఇప్పటికీ సజీవంగా ఉంటే, అతను ఇప్పుడు చాలా పాత ఉంటుంది."
Tom wanted me to help him.,నేను అతనికి సహాయం చేయాలనుకున్నాను.
Does Tom speak French better than Mary?,టోమ్ మేరీ కంటే ఎక్కువ ఫ్రెంచ్ మాట్లాడగలడా?
They'll kill me.,వారు నన్ను చంపడానికి ఉంటుంది.
Tom is stuck.,టామ్ చిక్కుకున్నాడు.
How does he do this?,అతను ఎలా ఈ చేస్తుంది?
Tom put his shirt on a hanger.,టోమ్ తన చొక్కాను హేంగర్ మీద పెట్టాడు.
I love making desserts.,నేను డెజర్ట్ తయారు ప్రేమ.
That sounded weird.,ఇది వింత అనిపించింది.
It could be a weapon.,ఇది ఒక ఆయుధం కావచ్చు.
I think you know what I'm talking about.,నేను ఏమి మాట్లాడుతున్నానో మీకు తెలుసు.
Where is your brother?,మీ సోదరుడు ఎక్కడ ఉంది?
What were we thinking?,మేము ఏమి ఆలోచిస్తున్నారో?
A nod is as good as a wink to a blind horse.,ఇది ఒక బ్లైండ్ గుర్రం కళ్ళు మూసివేయడం వంటి మంచి ఉంది.
Tom was home on Monday.,సోమవారం టోమ్ ఇంటికి వచ్చాడు.
She wanted him to say that he loved her.,ఆమె అతను ఆమె ప్రేమ అని అతనికి చెప్పాలని కోరుకున్నాడు.
Could you excuse us a sec?,మీరు మాకు ఒక క్షణం మన్నించండి?
He goes fishing every other day.,అతను ప్రతి రోజు ఫిషింగ్ వెళ్తాడు.
Tom doesn't want to leave.,టామ్ వెళ్లాలని అనుకోలేదు.
I'll miss everyone.,నేను వాటిని అన్ని కోల్పోతారు.
The customer agrees.,కస్టమర్ అంగీకరిస్తుంది.
I am working on my new book.,నేను నా కొత్త పుస్తకం పని చేస్తున్నాను.
It caught my eye.,ఇది నా దృష్టిని ఆకర్షించింది.
I won't let anybody hurt you.,ఎవరూ మీరు గాయపడిన వీలు కాదు.
Tom gave a famous singer ten thousand dollars to come to the restaurant to sing Happy Birthday.,టామ్ ఒక ప్రసిద్ధ గాయకుడికి పదివేల డాలర్లు ఇచ్చాడు మరియు హ్యాపీ బర్త్ డే పాడటానికి రెస్టారెంట్కు వచ్చాడు.
We're at home today.,మేము నేడు ఇంటికి వచ్చారు.
This isn't for sale.,ఇది అమ్మకానికి కాదు.
Tom heard everything they said.,వారు చెప్పిన ప్రతిదాన్ని టామ్ విన్నాడు.
Tom's career is over.,టామ్ యొక్క కెరీర్ ముగిసింది.
Tom is sleeping in the living room.,టామ్ గదిలో పడుకున్నాడు.
It started as a hobby.,ఇది ఒక అభిరుచిగా ప్రారంభమైంది.
Where were you yesterday?,మీరు నిన్న ఎక్కడ ఉన్నారు?
We have don't get many opportunities to speak French.,ఫ్రెంచ్ మాట్లాడటానికి మాకు చాలా అవకాశాలు రాలేదు.
Check it again.,మళ్ళీ తనిఖీ.
You were my inspiration.,మీరు నా ప్రేరణ.
I need to know who Tom is.,నేను టోమ్ ఎవరు తెలుసుకోవాలి.
"These aren't yours, are they?",ఇవి మీదేనా?
The tea is very tasty.,టీ చాలా రుచికరమైన ఉంది.
The burglar came into the house through this door.,దొంగ ఈ తలుపు ద్వారా ఇంటికి వచ్చింది.
Tom likes watching action movies.,టామ్ యాక్షన్ సినిమాలు చూడటానికి ఇష్టపడుతుంది.
She's the French ambassador to Portugal.,ఆమె పోర్చుగల్లో ఫ్రెంచ్ రాయబారి.
Tom did what he promised he'd do.,టోమ్ వాగ్దానం చేసినట్లు చేశాడు.
I don't want to break your heart.,నేను మీ గుండె విచ్ఛిన్నం చేయాలనుకోవడం లేదు.
I want to be ready for anything.,నేను ఏదైనా కోసం సిద్ధంగా ఉండాలనుకుంటున్నాను.
Tom and I aren't afraid.,టామ్ మరియు నేను భయపడము.
Tom and I both live and work in Australia.,టామ్ మరియు నేను ఇద్దరూ ఆస్ట్రేలియాలో నివసిస్తున్నారు మరియు పని చేస్తున్నారు.
The water was ice cold.,నీరు మంచు చల్లగా ఉంది.
Do you do anything else?,మీరు వేరే ఏదైనా చేస్తారా?
Tom pointed to his chest.,టోమ్ తన ఛాతీ వైపు చూపాడు.
They were silent.,వారు నిశ్శబ్దంగా ఉన్నారు.
I didn't know you'd be jealous.,మీరు అసూయ ఉన్నాయి తెలియదు.
We stayed behind to help Tom.,మేము టోమ్కు సహాయం చేయడానికి వెనుకకు నిలబడ్డాము.
Don't meddle in my affairs.,నా వ్యవహారాల్లో జోక్యం చేసుకోకండి.
They're all equal.,వీరంతా సమానమే.
Tom continued digging.,టామ్ త్రవ్వడం కొనసాగించాడు.
It's doubtful that anything will grow here.,ఇక్కడ ఏదో పెరుగుతుందని ఎటువంటి సందేహం లేదు.
I know that this is important to you.,ఇది మీకు ముఖ్యమైనదని నాకు తెలుసు.
My house is on the outskirts of town.,నా ఇల్లు పట్టణం శివార్లలో ఉంది.
It's time to get up.,ఇది అప్ పొందడానికి సమయం.
Mary is a brave woman.,మేరీ ధైర్యంగా ఉంది.
Why didn't you tell us there was a witness?,ఎందుకు మీరు మాకు ఒక సాక్షి ఉంది చెప్పలేదు?
Is that your idea?,ఇది మీ ఆలోచన?
Why are you yawning?,ఎందుకు మీరు ఏడుస్తున్నారు?
School begins in April.,పాఠశాల ఏప్రిల్లో ప్రారంభమవుతుంది.
Is it OK if I eat one of these apples?,నేను ఈ ఆపిల్ ఒకటి తినడానికి ఉంటే అది సరే?
Look straight ahead.,నేరుగా ముందుకు చూడండి.
That result was predictable.,ఫలితం ఊహించదగ్గది.
I didn't know you were going to be there.,మీరు అక్కడ ఉండబోతున్నారని నేను తెలియదు.
I'll phone you as soon as I get to the airport.,నేను విమానాశ్రయానికి వచ్చిన వెంటనే మీకు కాల్ చేస్తాను.
